vấn đề, cấp độ, loại, giải pháp
“Mỗi mặt của một khối lập phương được gán một số nguyên khác nhau. Sau đó, mỗi đỉnh được gán tổng các giá trị số nguyên trên các mặt gặp nhau tại đỉnh. Cuối cùng, các số đỉnh được thêm vào. Số lớn nhất phải chia tổng cuối cùng cho mọi cách đánh số có thể có của các khuôn mặt là bao nhiêu? , Cấp 5, Lý thuyết số, “Đặt tổng là $ S $. Số trên mỗi mặt được thêm vào $ S $ bốn lần riêng biệt, vì mỗi mặt viền trên các đỉnh $4$. Có 8 đô la đỉnh và mỗi đỉnh là tổng của số mặt $3$ vì mỗi đỉnh giáp mặt $3$. Do đó $ S $ là tổng của $8\ cdot 3 = 24 $ số mặt. Vì mỗi khuôn mặt được thêm 4 đô la lần và có 6 đô la khuôn mặt, chúng tôi biết không có khuôn mặt nào được lặp lại hoặc bỏ qua và mỗi khuôn mặt được thêm chính xác 4 đô la lần, vì vậy $ S = 4 (\ text {tổng số trên khuôn mặt}) $. Do đó, bất kể tổng các số trên các mặt là bao nhiêu, tổng $ S $ luôn chia hết cho $\ boxed {4} $.”
Tìm hệ số chung lớn nhất là $1001$ và $2431. $, Cấp 3, Lý thuyết số, "Theo thuật toán Euclide để tính toán các yếu tố chung lớn nhất, chúng ta có\ [
\ text {gcf} (1001.2431) =\ text {gcf} (1001.2431-2\ cdot 1001) =\ text {gcf} (1001.429).
\] Áp dụng thuật toán Euclide một lần nữa, chúng tôi nhận được\ [
\ text {gcf} (1001.429) =\ text {gcf} (429,1001-2\ cdot 429) =\ text {gcf} (429,143).
\] Nhận ra 429 là $3\ times 143 $, chúng tôi kết luận rằng hệ số chung lớn nhất của 1001 và 2431 là $\ boxed {143} . $”
Có bao nhiêu ngày trong một năm có $3$ trong chữ số hàng chục của ngày trong tháng? , Cấp độ 3, Lý thuyết số, “Có $12 $ tháng trong một năm. Tháng 1, tháng 3, tháng 5, tháng 7, tháng 8, tháng 10 và tháng 12 có 31 đô la ngày, vì vậy có $7$ tháng với $2 $ ngày có $3$ trong chữ số hàng chục. Tháng 4, tháng 6, tháng 9 và tháng 11 đều có 1 đô la ngày với 3 đô la ở vị trí hàng chục và tháng hai không có. Do đó, có $7\ times2+4=\ boxed {18} $ ngày với $3$ trong chữ số hàng chục.

Ngoài ra, vấn đề này có thể được giải quyết bằng phép trừ. Có $365 $ ngày trong một năm và $11$ tháng có $29$ ngày không có $3$ trong chữ số hàng chục, và tháng cuối cùng có $28 $ (giả sử một năm không nhuận) . $365- (11\ times29) -28=\ đóng hộp {18} $”
48 và 156 có bao nhiêu ước dương? , Cấp 3, Lý thuyết số, "Các ước chung của hai số nguyên là ước của GCD của chúng.

Chúng ta có $\ mathop {\ text {gcd}} (48,156) =12$, và 12 có sáu ước: 1, 2, 3, 4, 6 và 12. Vì vậy, câu trả lời là $\ boxed {6} $.”
Bội số tích cực nhất của 72 có chính xác 16 yếu tố tích cực là gì? , Cấp độ 3, Lý thuyết số, “Hệ số nguyên tố của 72 là $2 ^ 3\ cdot 3 ^ 2 $, có $ (3+1) (2+1) = 12 $ thừa số.

Nếu chúng ta nhân với 2, chúng ta nhận được $2^4\ cdot 3 ^ 2 $, có $ (4+1) (2+1) = 15 $ thừa số. Nhân với bất kỳ công suất cao hơn nào của 2 sẽ tạo ra một sản phẩm có hơn 16 yếu tố tích cực.

Nhân với 3 cho $2 ^ 3\ cdot 3 ^ 3 $, có $ (3+1) (3+1) = 16 $ hệ số dương.

Nhân với bất kỳ số nguyên tố $ p $ cho $2^3\ cdot 3 ^ 2\ cdot p $, có $ (3+1) (2+1) (1+1) = 24 $ thừa số.

Tương tự, nhân với bất kỳ số nguyên dương nào khác ngoài những số nguyên mà chúng ta đã xem xét sẽ tạo ra một sản phẩm có hơn 16 yếu tố. Do đó, $2^3\ cdot 3^3 =\ boxed {216} $ là bội số dương duy nhất của 72 với 16 thừa số dương.
“Nếu $10^ {51} - 9$ được viết dưới dạng một số nguyên ở dạng chuẩn, thì tổng các chữ số của số nguyên là bao nhiêu?” , Cấp độ 4, Lý thuyết số, “Vì $10 ^ {51} $ là số nguyên nhỏ nhất với $52$ chữ số, $10^ {51} -9 $ có 51 chữ số. Một chữ số là 1 và tất cả các chữ số khác là 9. Tổng các chữ số là $9\ cdot 50 + 1=\ boxed {451} $.”
$332_4-212_3 $ là bao nhiêu khi được biểu thị trong cơ số 10? , Cấp 2, Lý thuyết số, "Sau khi chuyển đổi cả hai số thành cơ số 10, chúng tôi trừ các giá trị. Chúng tôi nhận được $332_4=3\ cdot4^2+3\ cdot4^1+2\ cdot4^0=3 (16) +3 (4) +2 (1) =48+12+2=62$, và $212_3=2\ cdot3^2+1\ cdot3^1+2\ cdot3^0=2 (9) +1) +2 (1) = 18+3+2 = 23 $. Sự khác biệt là $62-23 =\ boxed {39} $.”
“Nếu $ x ^ 3 $ là một hệ số tích cực của $10! , $ có bao nhiêu giá trị số nguyên có thể có của $ x $? (Nhắc nhở: Đối với một số nguyên dương $ n $, biểu thức $ n! $ là viết tắt của tích của các số nguyên từ 1 đến (và bao gồm) $ n $.)” , Cấp 5, Lý thuyết số, “Đầu tiên, chúng tôi tính $10! :$
\ begin {align*} 10! &=10\ cdot 9\ cdot 8\ cdot 7\ cdot 6\ cdot 5\ cdot 4\ cdot 3\ cdot 2\ cdot 1\\ &=2^8\ cdot 3 ^ 4\ cdot 5 ^ 2\ cdot 7. \ end {align*}
Do đó, $ x $ có thể là $1, 2 ^ 1, 2 ^ 2, 3, 2 ^ 1\ cdot 3,\ text {or} 2 ^ 2\ cdot 3 $ cho tổng số $\ boxed {6} $ giá trị có thể có của $ x. $”
Chữ số ở vị trí phần trăm của số thập phân tương đương của $\ frac {9} {160} $ là bao nhiêu? , Cấp 2, Lý thuyết số, "Vì mẫu số của $\ dfrac {9} {160} $ là $2 ^ 5\ cdot5 $, chúng tôi nhân tử số và mẫu số với $5^4$ để thu được\ [
\ frac {9} {160} =\ frac {9\ cdot 5^4} {2^5\ cdot 5\ cdot 5\ cdot 5^4} =\ frac {9\ cdot 625} {10^5} =\ frac {5625} {10 ^ 5} = 0,05625.
\] Vì vậy, chữ số ở vị trí phần trăm là $\ boxed {5} $.”
“Một hình chữ nhật có độ dài cạnh nguyên. Một cặp cạnh đối diện được tăng thêm $30\% $ và cặp bên kia giảm $20\% $. Độ dài cạnh mới cũng là số nguyên. Diện tích nhỏ nhất có thể, tính bằng đơn vị vuông, của hình chữ nhật mới là bao nhiêu? , Cấp độ 4, Lý thuyết số, “Hãy để $ a $ và $ b $ là độ dài cạnh ban đầu. Độ dài cạnh mới là $1.3a = 13a/10 $ và $0.8b = 4b/5 $. Do đó, các giá trị số nguyên nhỏ nhất có thể có của $ a $ và $ b $ là $ a = 10 $ và $ b = 5 $. Độ dài cạnh mới là $13$ và $4$, và diện tích của hình chữ nhật mới là $13\ cdot4 =\ boxed {52} $ đơn vị vuông.”
“Bạn của bạn có một bộ sưu tập trứng bao gồm ít nhất 200 đô la trứng. Anh ấy muốn lưu trữ chúng trong hộp đựng trứng. Sau khi đổ đầy càng nhiều thùng chứa càng tốt, hộp đựng cuối cùng còn sót lại 1 đô la trứng. Sau đó, anh quyết định lưu trữ trứng của mình trong các hộp đựng trứng làm bánh tùy chỉnh, nơi mỗi hộp đựng có thể chứa 13 đô la trứng. Hóa ra, sau khi lấp đầy càng nhiều hộp đựng này càng tốt, anh ta vẫn còn thừa 1 đô la trứng. Số lượng trứng tối thiểu mà bạn của bạn có thể có là bao nhiêu?” , Cấp 3, Lý thuyết số, “Chúng tôi muốn số nguyên nhỏ nhất $ x $ sao cho $ x\ ge 200 $ và $ x $ cho phần còn lại là $1 $ khi chia cho cả $12$ và $13 $. Chúng ta có thể viết $ x = 12\ cdot 13n + 1 = 156n+1$, vì vậy bây giờ chúng ta cần tìm một giá trị đủ lớn của $ n $ sao cho $ x\ ge 200 $. Nếu $ n = 1 $, $ x = 157 $, nhưng khi $ n = 2 $, $ x = 313 $. Do đó, bạn của bạn có $\ boxed {313} $ trứng.”
Express $555_ {10} $ trong cơ sở $5$. , Cấp độ 3, Lý thuyết số, “Chúng tôi viết $555$ theo lũy thừa của $5$. Sức mạnh lớn nhất của $5 $ nhỏ hơn $555 $ là $5 ^ 3 = 125 $ và bội số lớn nhất của $125 $ nhỏ hơn $555 $ là $4$. Chúng tôi nhận được $555- 4\ cdot 125 = 55$. Sức mạnh lớn nhất của 5 đô la nhỏ hơn 55 đô la là 5 ^ 2 = 25 đô la và bội số lớn nhất của 25 đô la nhỏ hơn 55 đô la là 2 đô la. Chúng tôi nhận được $55 - 2\ cdot 25 = 5 $, đó là $5^1$. Do đó, chúng ta có thể viết $555$ là $4\ cdot 5 ^ 3 + 2\ cdot 5 ^ 2 + 1\ cdot 5 ^ 1 $. Do đó, câu trả lời là $\ boxed {4210_ {5}} $.”
“Số nguyên lẻ lớn nhất là hệ số 5 đô la là gì! $? (Nhắc nhở: Đối với một số nguyên dương $ n $, biểu thức $ n! $ là viết tắt của tích của các số nguyên từ 1 đến (và bao gồm) $ n $.)” , Cấp 2, Lý thuyết số, "Vì tích của các số nguyên lẻ là số lẻ, chúng ta có thể tìm được thừa số lẻ lớn nhất của một số nguyên bằng cách loại bỏ các thừa số của 2 khỏi hệ số nguyên tố của nó. Vì các thừa số nguyên tố lẻ duy nhất của 5! là 5 và 3, ước số lẻ lớn nhất của 5! là $5\ times 3 =\ boxed {15} $.”
“Tuổi của cha tôi là $1222_ {3} $, ở cơ sở ba để đại diện cho ba chi dưới của ông - hai chân và một cây gậy. Anh ta ở căn cứ mười bao nhiêu tuổi? , Cấp 3, Lý thuyết số, $1222_ {3} = 2\ cdot3^ {0} +2\ cdot3^ {1} +2\ cdot3^ {2} +1\ cdot3^ {3} = 2+6+18+27 =\ đóng hộp {53} $.
“Khi cơ số 10 số nguyên 269 được chuyển đổi thành cơ số 5, tổng các chữ số là bao nhiêu?” , Cấp độ 3, Lý thuyết số, “Sức mạnh lớn nhất của 5 nhỏ hơn 269 là $5 ^ 3 = 125 $. Bội số lớn nhất của 125 nhỏ hơn 269 là $2\ cdot125 = 250 $. Vì vậy, chữ số ở vị trí cho $5^3$ là 2. Sau khi trừ 250 từ 269, chúng ta có $269-250 = 19 $. Chúng ta có thể biểu thị 19 là $3\ cdot5 ^ 1+4\ cdot5 ^ 0 $. Điều đó có nghĩa là chúng tôi có 3 ở vị trí với giá 5 ^ 1 đô la và 4 ở vị trí với giá 5 ^ 0 đô la. Biểu diễn cơ số 5 của 269 là $2034_5 $, vì vậy tổng các chữ số là $2+0+3+4 =\ boxed {9} $.”
Số nguyên cơ số 10 340 khi được biểu thị trong cơ số 7 là gì? , Cấp độ 3, Lý thuyết số, “Nếu bạn nhận thấy rằng 340 gần với $7^3 = 343 = 1000_7 $, thì nó làm cho vấn đề dễ dàng hơn nhiều. Vì $343 = 1000_7 $, điều đó tạo ra $342 = 666_7 $, hoặc số có ba chữ số lớn nhất trong cơ số 7. Để có được 340, chúng tôi trừ 2, có nghĩa là trừ 2 từ chữ số ở vị trí $7^0 $. Điều đó để lại cho chúng ta $\ boxed {664_7} $.

Ngoài ra, lũy thừa lớn nhất của 7 nhỏ hơn 340 là $7^2 = 49 $, và bội số lớn nhất của 49 nhỏ hơn 340 là $6\ cdot49 = 294 $. Điều đó có nghĩa là có 6 ở vị trí $7^2 $. Chúng ta có $340-294 = 46 $ còn lại, có thể được biểu diễn dưới dạng $6\ cdot7 ^ 1+4\ cdot7 ^ 0 $. Vì vậy, chúng tôi nhận được $340=6\ cdot7^2+6\ cdot7^1+4\ cdot7^0=\ boxed {664_7} $.”
“Cho rằng $ n > 1 $, số nguyên dương nhỏ nhất $ n $ có ước dương có tích là $ n ^ 6 $ là bao nhiêu?” , Cấp 5, Lý thuyết số, “Hãy nhân các ước của một số nguyên dương, giả sử $12$. Các ước của $12 $ là $1,2,3,4,6, $ và $12 $. Tích của các ước của 12 là $1\ cdot2\ cdot3\ cdot4\ cdot6\ cdot12= (1\ cdot12) (2\ cdot 6) (3\ cdot4) =12^3$. Các yếu tố có thể được nhóm lại theo cách này cho bất kỳ số nguyên dương nào có số ước chẵn. Chúng tôi nhận thấy rằng nếu số $ d $ của ước là chẵn, thì tích của các ước của $ n $ là $ n ^ {d/2} $. Giải $ n ^ 6 = n ^ {d/2} $, chúng tôi tìm thấy $ d = 12 $.

Nhớ lại rằng chúng ta có thể xác định số yếu tố của $ n $ bằng cách thêm $1 $ vào mỗi số mũ trong hệ số nguyên tố của $ n $ và nhân các kết quả. Chúng tôi làm việc ngược lại để tìm số nguyên dương nhỏ nhất với các yếu tố $12 $. Mười hai có thể được viết dưới dạng tích của các số nguyên lớn hơn 1 theo bốn cách: $12$, $2\ cdot 6$, $3\ cdot 4$ và $2\ cdot2\ cdot3 $. Các thừa số nguyên tố làm phát sinh các tích này có tập hợp các số mũ $\ {11\} $, $\ {5,1\} $, $\ {3,2\} $ và $\ {2,1,1\} $. Trong mỗi trường hợp, chúng ta giảm thiểu $ n $ bằng cách gán các số mũ theo thứ tự giảm dần cho các số nguyên tố $2,3,5,\ ldot $. Do đó, số nguyên dương nhỏ nhất với 12 thừa số phải nằm trong danh sách $2^ {11} =2048 $, $2^5\ cdot3 = 96 $, $ {2^3\ cdot3 ^ 2} = 72 $, và $2^2\ cdot3\ cdot5 = 60 $. Nhỏ nhất trong số này là $\ boxed {60} $.”
“Wendy nhận thấy khi cô ấy xếp chồng các khu nhà của mình thành đống 5, cô ấy còn lại 3 và khi cô ấy xếp chúng thành đống 7, cô ấy còn lại 5. Nếu cô ấy có ít hơn mười đô la trị giá một phần tư, cô ấy có bao nhiêu quý? , Cấp độ 2, Lý thuyết số, “Hãy để $ a $ là số quý. Chúng tôi biết rằng\ begin {align*}
a\ equiv 3\ pmod 5\\
a\ equiv 5\ pmod 7
\ end {align*} Đồng dư $ (1) $ có nghĩa là tồn tại một số nguyên không âm $ n $ sao cho $ a = 3+5n $. Thay thế nó vào $ (b) $ cho\ [3+5n\ equiv 5\ pmod 7\ ngụ ý n\ equiv 6\ pmod 7\] Vì vậy $ n $ có giới hạn dưới là $6$. Sau đó $n\ ge 6\ ngụ ý a=3+5n\ ge 33$. $33$ xảy ra để thỏa mãn cả hai đồng dư, vì vậy nó là giải pháp chung nhỏ nhất. Vì cô ấy có ít hơn 10 đô la đô la trị giá hàng quý, cô ấy có ít hơn 40 đô la quý. Nếu $ b $ là một giải pháp chung, trừ $33$ từ cả hai phía của cả hai đồng dư sẽ cho\ begin {align*}
b-33\ equiv -30\ equiv 0\ pmod 5\nsố\\
b-33\ equiv -28\ equiv 0\ pmod 7\nsố
\ end {align*} Vì $\ gcd (5,7) =1$, chúng ta có $ b-33\ equiv 0\ pmod {5\ cdot 7} $, nghĩa là $ b\ equiv 33\ pmod {35} $. Một vài giải pháp tích cực đầu tiên của điều này là $33,68 $. Do đó, chỉ tồn tại một giải pháp tích cực nhỏ hơn $40$, mà chúng tôi tìm thấy trước đó là $\ boxed {33} $.
“Số nguyên nhỏ nhất là $ n $, lớn hơn $1$, sao cho $ n ^ {-1}\ pmod {130} $ và $ n ^ {-1}\ pmod {231} $ đều được xác định?” , Cấp 5, Lý thuyết số, "Để $ n $ có nghịch đảo $\ pmod {130} $, cần phải có $ n $ tương đối nguyên tố với 130. Ngược lại, nếu $ n $ tương đối nguyên tố với 130, thì $ n $ có nghịch đảo $\ pmod {130} $. Điều tương tự cũng xảy ra với 231. Do đó, chúng tôi đang tìm kiếm $ n $ dương nhỏ nhất tương đối nguyên tố với 130 và 231.

Chúng ta có thể thừa số $130=2\ cdot5\ cdot13 $ và $231=3\ cdot7\ cdot11 $. Đây là tất cả các số nguyên tố lên đến 13, vì vậy không có số nguyên nào từ $2-16 $ là tương đối nguyên tố cho cả 130 và 231. Tuy nhiên, 17 là tương đối nguyên tố cho cả hai số này. Vì vậy, số nguyên dương nhỏ nhất lớn hơn 1 có modulo nghịch đảo nhân 130 và 231 là $\ boxed {17} $.”
Tìm sản phẩm của $6_8\ cdot 7_8.$ Thể hiện câu trả lời của bạn trong cơ sở $8. $, Cấp 3, Lý thuyết số, "Nhân, chúng ta thấy rằng $6_8\ cdot 7_8 = 42_ {10} = 52_8.$ Viết ra, $$\ begin {array} {@ {} c@ {\;} c@ {} c@ {} c} {} c} && & 6_8\ &\ times & & 7_8\\ cline {2-4} & & 2_8\\\ end {array} $$ Như vậy, câu trả lời là $\ boxed {52_8} . $”
“Hai dãy $A =\ {a_0, a_1, a_2,\ ldots\} $ và $B=\ {b_0, b_1, b_2,\ ldots\} $ được định nghĩa như sau:\ [a_0 = 0, ~a_1 = 1, ~a_n= a_ {n-1} +b_ {n-2}\ hspace {2mm}\ text {for}\ hspace {2mm} n\ ge2\]\ [b_0=1, ~b_1=2, ~b_n=a_ {n-2} +b_ {n-1}\ hspace {2mm}\ text {for}\ hspace {2mm} n\ ge2\] Phần còn lại là gì khi $a_ {50} +b_ {50} $ được chia cho $5$? , Level 5, Number Theory, "Vấn đề được đơn giản hóa rất nhiều bằng cách xác định dãy $ C =\ {c_0, c_1, c_2,\ ldots\} $ là $ c_n = a_n+b_n $ cho tất cả các số nguyên không âm $ n $. Sau đó $ c_0 = a_0+b_0 = 0+1 = 1 $ và $ c_1 = a_1+b_1 = 1+2 = 3 $. Ngoài ra, với số nguyên $n>1$ ta có\ begin {align*}
c_n&=a_n+b_n\\
&= (a_ {n-1} +b_ {n-2}) + (a_ {n-2} +b_ {n-1})\\
&= (a_ {n-2} +b_ {n-2}) + (a_ {n-1} +b_ {n-1})\\
&=c_ {n-2} +c_ {n-1}.
\ end {align*} Điều này thuận tiện vì chúng ta muốn xác định phần còn lại của $ a_ {50} +b_ {50} =c_ {50} $. Do đó, chúng ta không còn phải suy nghĩ về các chuỗi $ A $ và $ B $, mà chỉ về $ C $.

Một vài điều khoản đầu tiên của $ C $ là $1,3,4,7,11,18,29$. Khi giảm modulo $5$, các điều khoản này là $1,3,4,2,1,3,4$. Bốn điều khoản đầu tiên là $1,3,4,2$. Chúng tiếp tục lặp lại $\ pmod 5$ vì hai số hạng tiếp theo là $1,3$ và tất cả các số hạng được định nghĩa là tổng của hai số hạng trước đó. Vì chu kỳ có độ dài $4$ và $50\ equiv 2\ pmod 4$, chúng ta có $ $ c_ {50}\ equiv c_2\ pmod 5, $$ và do đó $ c_ {50}\ equiv\ boxed {4}\ pmod 5 $.”
Tìm số nguyên dương thứ một trăm có thể được viết bằng cách sử dụng không có chữ số nào ngoài chữ số 0 và 1 trong cơ số 3. Thể hiện câu trả lời của bạn dưới dạng số nguyên cơ số 10. , Cấp 5, Lý thuyết số, "Mục tiêu là đếm trong cơ số 3 chỉ sử dụng các chữ số nhị phân. $100^ {\ text {th}} $ số nguyên nhị phân dương nhỏ nhất là $100 = 1100100_2 $, vì vậy $100 ^ {\ text {th}} $ số nguyên dương nhỏ nhất có thể được viết chỉ với các chữ số nhị phân là $1100100_3 =\ boxed {981} $.”
Có bao nhiêu số có ba chữ số chia hết cho 13? , Cấp 2, Lý thuyết số, "Số ba chữ số nhỏ nhất chia hết cho 13 là $13\ lần 8 = 104 $, vì vậy có bảy bội số hai chữ số của 13. Số có ba chữ số lớn nhất chia hết cho 13 là $13\ times 76=988 $. Do đó, có $76-7=\ boxed {69} $ số ba chữ số chia hết cho 13.

\ [OR\] Bởi vì phần nguyên của $\ frac {999} {13} $ là 76, nên có 76 bội số của 13 nhỏ hơn hoặc bằng 999. Bởi vì phần nguyên của $\ frac {99} {13} $ là 7, nên có 7 bội số của 13 nhỏ hơn hoặc bằng 99. Điều đó có nghĩa là có $76-7=\ boxed {69} $ bội số của 13 trong khoảng từ 100 đến 999.”
“Một thiếu niên là một người 13, 14, 15, 16, 17, 18 hoặc 19 tuổi. Sản phẩm của độ tuổi của một nhóm thanh thiếu niên cụ thể là 705.600. Ý nghĩa của tuổi của họ trong năm là gì? Thể hiện câu trả lời của bạn dưới dạng số thập phân đến phần mười gần nhất. , Cấp độ 4, Lý thuyết số, “Trong độ tuổi thiếu niên, 13, 17 và 19 là số nguyên tố; $14 = 2\ cdot7 $, $15 = 3\ cdot5 $, $16 = 2 ^ 4 $, và $18 = 2\ cdot3 ^ 2 $. Hệ số nguyên tố của 705,600 là $2 ^ 6\ cdot3 ^ 2\ cdot5 ^ 2\ cdot7 ^ 2 $. Kể từ $7^2|705600 $, 2 người phải 14 tuổi (trong đó chăm sóc $2^2\ cdot7 ^ 2 $). Tương tự, kể từ $5^2|705600 $, 2 người phải 15 tuổi (trong đó chăm sóc $3^2\ cdot5 ^ 2 $). $2 ^ 4 $ vẫn còn, có nghĩa là 1 người là 16. Do đó, giá trị trung bình của các độ tuổi là $\ frac {2\ cdot14+2\ cdot15+16} {5} =\ frac {74} {5} =\ boxed {14.8} $ năm.
Có bao nhiêu ô vuông hoàn hảo là các yếu tố của $2\ lần 4\ lần 6\ lần 8\ lần 10\ lần 12? $, Cấp 5, Lý thuyết số, "Chúng tôi thừa số nguyên tố của tích đã cho là $2^ {10}\ cdot 3 ^ 2\ cdot5. $ Nhớ lại rằng một số là một hình vuông hoàn hảo nếu và chỉ khi tất cả các thừa số nguyên tố của nó được nâng lên một lũy thừa chẵn; vì vậy $ f $ là một hệ số nếu và chỉ khi $ f = 2^ {2a}\ cdot 3^ {2b} $ cho\ $0 leq 2a leq 10$ và $0\ leq 2b\ leq 2.$ Vì vậy, chúng tôi có $6$ lựa chọn cho $ a $ và $2$ lựa chọn cho $ b, $ dẫn đến tổng số $6\ cdot 2 =\ boxed {12} $ khả năng.”
Phần còn lại là bao nhiêu khi $225 ^ {66} -327 ^ {66} $ được chia cho $17 $? , Cấp 4, Lý thuyết số, "Đầu tiên chúng ta sử dụng thuộc tính $ a\ equiv b\ pmod {m} $ ngụ ý $ a ^ c\ equiv b ^ c\ pmod {m} $.

Kể từ $225\ equiv 4\ pmod {17} $ và $327\ equiv 4\ pmod {17} $, $$225^ {66} -327^ {66}\ equiv 4 ^ {66} -4^ {66} =\ boxed {0}\ pmod {17} . $$”
Vào một ngày thứ ba, một ảo thuật gia nói, 'Tôi đã khiến vợ tôi biến mất 31 ngày trước. Ngày nào trong tuần anh ấy khiến cô ấy biến mất?” , Level 2, Number Theory, "Kể từ $31\ equiv 3$ (mod 7), anh ta đã khiến vợ mình biến mất 3 ngày trước ngày thứ Ba, hoặc $\ boxed {\ mbox {Saturday}} $.”
Bạn của bạn có hơn 200 tem. Anh ta có một cuốn sách tem, nơi anh ta có thể đặt 30 con tem trên mỗi trang. Anh ta đã đặt tem vào sổ tem của mình theo cách mà trang duy nhất không được lấp đầy hoàn toàn bằng tem là trang cuối cùng. Trang cuối cùng có 5 con tem trong đó. Số lượng tem nhỏ nhất mà bạn của bạn có thể có là bao nhiêu? , Cấp 2, Lý thuyết số, "Một số nguyên tương đương với 5 mod 30 có thể được viết dưới dạng $30k + 5$. Trong tình huống này, $30k+5 $ đại diện cho số tem mà bạn của bạn có, trong khi $ k $ đại diện cho số trang đã điền mà anh ta có. Chúng tôi muốn giải bất đẳng thức $30k+5 > 200 $. Bất đẳng thức này có nghiệm $k > 6\ frac {1} {2} $. Vì $ k $ đại diện cho số trang được điền, $ k $ phải là một số nguyên. Số nguyên nhỏ nhất lớn hơn $6\ frac {1} {2} $ là $7$, vì vậy bạn của bạn có $30 (7) + 5 =\ boxed {215} $ tem.
Tích của tất cả các số nguyên tố từ 1 đến 100 bằng $ P $. Phần còn lại là bao nhiêu khi $ P $ được chia cho 16? , Cấp độ 5, Lý thuyết số, “Các số nguyên tố giữa 1 và 100 là 2, 3, 5, 7, 11, 13, 17, 19, 23, 29, 31, 37, 41, 43, 47, 53, 59, 61, 67, 71, 73, 79, 83, 89 và 97.

Chúng tôi tính toán dư lượng của chúng modulo 16:2, 3, 5, 7, 11, 13, 1, 3, 7, 13, 15, 5, 9, 11, 15, 5, 11, 13, 3, 7, 9, 15, 3, 9, 3, 9, 9, 9, 9, 1.

Chúng tôi nhân tất cả các số modulo 16, lợi dụng thực tế là $3\ cdot 5\ equiv -1 (\ text {mod} 16) $, $7\ cdot9\ equiv -1 (\ text {mod} 16) $, $11\ cdot 13\ equiv -1 (\ text {mod} 16) $, và $15\ equiv -1 (\ text {mod} 16) $. Chúng tôi thấy rằng câu trả lời của chúng tôi là $\ boxed {6} $.”
Tích của các số nguyên 240 và $ k $ là một khối lập phương hoàn hảo. Giá trị dương nhỏ nhất có thể có của $ k $ là bao nhiêu? , Cấp độ 3, Lý thuyết số, “$240 = 2 ^ 4\ cdot3\ cdot5 = 2 ^ 3 (2\ cdot3\ cdot5) $. Để $240k$ là một khối lập phương hoàn hảo (và không phải là một hình vuông hoàn hảo), $ k $ phải có ít nhất $2^2\ cdot3 ^ 2\ cdot5 ^ 2 =\ boxed {900} $.”
“Cho rằng $33^ {-1}\ equiv 77\ pmod {508} $, tìm $11^ {-1}\ pmod {508} $ dưới dạng modulo dư 508. (Đưa ra câu trả lời từ 0 đến 507, bao gồm.) , Cấp 5, Lý thuyết số, "Kể từ $33^ {-1}\ equiv 77\ pmod {508} $,\ begin {align*}
11^ {-1} &\ equiv (33\ cdot 3^ {-1}) ^ {-1}\\
&\ equiv 33^ {-1}\ cdot 3\\
&\ equiv 77\ cdot 3\\
&\ equiv\ đóng hộp {231}\ pmod {508}.
\ end {align*}”
$ n $ lớn nhất là bao nhiêu sao cho $ a = 2 ^ {306}\ cdot 3 ^ {340} $ là lũy thừa thứ $ n $ hoàn hảo? , Cấp độ 5, Lý thuyết số, “Chúng tôi khẳng định rằng $ a $ là lũy thừa thứ $ n $ hoàn hảo nếu và chỉ khi $ n $ chia cả $306 $ và $340 $. Để thấy điều này, giả sử rằng $n\ mid 306$ và $n\ mid 340 $. Sau đó $2^ {\ frac {306} {n}} 3^ {\ frac {340} {n}} $ là một số nguyên có lũy thừa thứ $ n $ là $ a $. Ngược lại, giả sử $ b ^ n = a $. Sau đó, các số nguyên tố duy nhất chia $ b $ là $2 $ và $3$. Chọn $ c $ và $ d $ sao cho $ b = 2 ^ {c} 3 ^ {d} $. Sau đó $ b ^ n = 2 ^ {cn} 3 ^ {dn} = 2 ^ {306} 3 ^ {340} $, ngụ ý $ n\ mid 306 $ và $ n\ mid 340 $. Điều này kết luận bằng chứng của chúng tôi về tuyên bố rằng $ a $ là sức mạnh thứ $ n $ nếu và chỉ khi $ n $ chia cả $306 $ và $340 $.

Số lớn nhất chia đồng thời hai số là GCD của chúng. Sử dụng thuật toán Euclide, GCD của $306 $ và $340$ giống như GCD là $340$ và $340-306 = 34 $. Vì $34$ chia $340$, GCD của hai cái này là $34$, vì vậy $ n $ lớn nhất có thể là $\ boxed {34} $.”
“Tổng của tất cả các số nguyên dương $ r $ thỏa mãn $$\ mathop {\ text {lcm}} [r,700] = 7000 ~ là bao nhiêu? $$”, Cấp 5, Lý thuyết số, “Lưu ý các thừa số nguyên tố $700 = 2 ^ 2\ cdot 5 ^ 2\ cdot 7 $ và $7000 = 2 ^ 3\ cdot 5 ^ 3\ cdot 7 $.

